[
  {
    "ags": "09271146",
    "name": "Plattling",
    "plz": ["94447"],
    "bundesland": "BY",
    "jahre": [
      {
        "jahr": 2024,
        "einwohner": 13200,
        "file": "09271146_2024.json"
      },
      {
        "jahr": 2025,
        "einwohner": 13160,
        "file": "09271146_2025.json"
      },
      {
        "jahr": 2026,
        "einwohner": 13296,
        "file": "09271146_2026.json"
      }
    ]
  },
  {
    "ags": "09190142",
    "name": "Polling",
    "plz": ["82398", "82380"],
    "bundesland": "BY",
    "jahre": [
      {
        "jahr": 2024,
        "einwohner": 3605,
        "file": "09190142_2024.json"
      },
      {
        "jahr": 2025,
        "einwohner": 3633,
        "file": "09190142_2025.json"
      },
      {
        "jahr": 2026,
        "einwohner": 3635,
        "file": "09190142_2026.json"
      }
    ]
  }
]
